link,title
https://habr.com/ru/company/Voximplant/blog/489040/,Contact Center AI: третий участник в разговоре – это нормально
https://habr.com/ru/post/488784/,Коммерциализация доработок свободного ПО под Copyleft лицензиями
https://habr.com/ru/post/489046/,Self-driving ГАЗ66 Monster Truck 1/16
https://habr.com/ru/company/kksng/blog/488942/,"Артефакты для UX-ёров и команды: что это, зачем нужны и как выбрать"
https://habr.com/ru/company/piter/blog/489038/,Книга «Java Concurrency на практике»
https://habr.com/ru/post/489034/,"Новое приложение ЕИС для мобильных – мучение или спасение для тех, кто ищет госзакупки?"
https://habr.com/ru/post/488968/,Простое обнаружение проблем производительности в PostgreSQL
https://habr.com/ru/company/jugru/blog/481096/,Топ лучших докладов Joker 2019
https://habr.com/ru/company/skyeng/blog/489010/,"Делимся самым большим в РФ пластом данных по онлайн-обучению с проектами по лингвистике, персонализации, педдизайну, ML"
https://habr.com/ru/company/flant/blog/480722/,Одна история с оператором Redis в K8s и мини-обзор утилит для анализа данных этой БД
https://habr.com/ru/post/489028/,Про удаленную работу
https://habr.com/ru/company/itsumma/blog/489026/,Изменение алгоритмов Google AdSense может привести к вымогательству у владельцев сайтов и веб-мастеров
https://habr.com/ru/post/489024/,JavaScript библиотека Webix глазами новичка. Часть 5. Работа с данными на стороне пользователя
https://habr.com/ru/post/488958/,Расшифровка моего интервью с автором Ruby
https://habr.com/ru/company/ibs/blog/488972/,16 тысяч подключений в секунду: как мы тестировали СКАЛУ-Р Виртуальное Рабочее Место
https://habr.com/ru/post/488996/,INVESTMENT-READY
https://habr.com/ru/company/misis/blog/489016/,"Герман Греф: «Мы пытались организовать дискуссию по поводу AGI, и ни один уважающий себя ученый на нее не приходил»"
https://habr.com/ru/company/otus/blog/489012/,"Google Cloud Spanner: хороший, плохой, злой"
https://habr.com/ru/company/habr_career/blog/488986/,Кто такой наставник и какими гибкими навыками он должен обладать
https://habr.com/ru/company/ruvds/blog/488662/,"Браузерные расширения, необходимые каждому веб-разработчику"
https://habr.com/ru/post/489002/,Распределенный реестр для колесных пар: опыт с Hyperledger Fabric
https://habr.com/ru/post/488994/,DDR5? Да мы и с DDR4-то едва познакомились
https://habr.com/ru/post/488898/,Наём сотрудников никуда не годится. И ваш тоже
https://habr.com/ru/post/488990/,"Обзор полнолицевой маски UNIX 5100, фильтров к ней, сравнение с моделями UNIX 5000, 6100 и маской ППМ-88"
https://habr.com/ru/company/lamoda/blog/488186/,Мой путь QA инженера: через выгорание к тестированию в кайф
https://habr.com/ru/company/vivaldi/blog/488980/,"Жесты, которые радуют"
https://habr.com/ru/company/dins/blog/488976/,"Приглашаем на DINS DevOps EVENING: разберем два примера инфраструктуры и поговорим, как облегчить поддержку"
https://habr.com/ru/company/lanit/blog/488974/,Как организовать работу с дистрибуторской сетью: приглашаем на вебинар
https://habr.com/ru/company/avito/blog/488936/,"Молчание вентиляторов. Google Colab, Javascript и TensorflowJS"
https://habr.com/ru/post/487680/,Полный разбор экзамена ШАД-2019
https://habr.com/ru/company/pm/blog/488826/,Распознаем повышение привилегий в ABBYY FineReader
https://habr.com/ru/company/lenovo/blog/488888/,Ноутбук ThinkPad стал «мозгом» робота
https://habr.com/ru/company/promopult/blog/488700/,"Внедрили микроразметку, а расширенных сниппетов нет: 10 возможных причин"
https://habr.com/ru/company/ua-hosting/blog/488842/,"Поймать электрон: наблюдение процесса, занимающего квинтиллионную долю секунды"
https://habr.com/ru/post/488640/,Open Source Guides: Запуск проекта с открытым исходником
https://habr.com/ru/post/488966/,"Ansible playbooks — это код: проверяем, тестируем, непрерывно интегрируем. Иван Пономарёв"
https://habr.com/ru/post/488964/,Срочные задачи. Да придёт Спаситель
https://habr.com/ru/company/microsoft/blog/488926/,5 бесплатных курсов для ИИ-инженеров от Microsoft
https://habr.com/ru/company/yandex/blog/488588/,C++20 утверждён! Чего ждать и к чему готовиться разработчикам в C++23
https://habr.com/ru/post/488786/,Насколько детальной должна быть User Story?
https://habr.com/ru/post/488962/,Можно ли писать скрипты на C++?
https://habr.com/ru/post/488960/,"Программирование, иммунитет и армия"
https://habr.com/ru/company/tensor/blog/488104/,DBA: находим бесполезные индексы
https://habr.com/ru/company/recognitor/blog/488954/,Как объяснить роботу свою точку зрения
https://habr.com/ru/post/488652/,"История симлиша — языка, определившего судьбу серии игр Sims"
https://habr.com/ru/post/488950/,Время в клеточном автомате
https://habr.com/ru/post/488794/,Golang + Phaser3 = MMORPG — Клиент и Сервер
https://habr.com/ru/post/488948/,Тестирование REST API на Golang. 56000 [#/sec] не предел?
https://habr.com/ru/post/488946/,Меню консольных команд на python
https://habr.com/ru/post/488944/,Как коронавирус действует на акции биотеха
https://habr.com/ru/company/ua-hosting/blog/424055/,Хостинг и выделенные серверы: отвечаем на вопросы. Часть 1
https://habr.com/ru/company/russian_rehab_industry/blog/488930/,Не включается компьютер? Техническая поддержка для инвалидов по зрению и слуху поможет удалённо
https://habr.com/ru/company/dodopizzadev/blog/488918/,Data Engineer or die: история одного разработчика
https://habr.com/ru/post/488928/,Почему «погугли сам» — не наш метод и как мы прокачиваем Базу знаний для техподдержки
https://habr.com/ru/company/google/blog/488886/,2019-й по версии Chrome
https://habr.com/ru/company/microsoft/blog/488484/,SQL Launch — мероприятие Microsoft SQL Server 2019
https://habr.com/ru/company/piter/blog/488910/,Книга «Любовь и математика. Сердце скрытой реальности»
https://habr.com/ru/post/487358/,"BERT, ELMO и Ко в картинках (как в NLP пришло трансферное обучение)"
https://habr.com/ru/company/otus/blog/488912/,Предсказание стоимости биткоина по новостям на Python
https://habr.com/ru/post/488908/,KPI копирайтера или особенности оценки работы удаленных авторов в штате и фрилансеров
https://habr.com/ru/company/varonis/blog/488896/,Выкупать — так королеву: Varonis расследует быстро распространяющийся шифровальщик-вымогатель “SaveTheQueen”
https://habr.com/ru/company/jugru/blog/488868/,Анонс Mobius 2020 Piter: что волнует мобильных разработчиков?
https://habr.com/ru/company/englishdom/blog/488768/,"Bloody hell, или Как ругаться на английском, чтобы тебя приняли за культурного человека"
https://habr.com/ru/company/otus/blog/488890/,5 советов по стратегии рекрутинга через социальные сети
https://habr.com/ru/company/misis/blog/488884/,Станет ли 3D-принтер моей персональной фабрикой на балконе?
https://habr.com/ru/company/habr/blog/483212/,"Хабр Викли #39 / Гаджет-шоу MWC закрыли, как стать разрабом в 14 лет, эмоционально про опенспейсы и патент на цвет"
https://habr.com/ru/company/it_people/blog/488880/,Секция DevOps на конференции DUMP2020. Порадуемся / поплачем вместе
https://habr.com/ru/company/regionsoft/blog/488856/,"Ну CRM и CRM. Всё проще, чем вы думаете"
https://habr.com/ru/company/hh/blog/488742/,"Видишь архитектуру? И я не вижу, а она есть"
https://habr.com/ru/post/488876/,Исследование и преобразование сортировкой псевдослучайных последовательностей
https://habr.com/ru/post/488872/,Вебинар «Цифровой двойник в IIoT»
https://habr.com/ru/company/avito/blog/488658/,Использование faiss для поиска по многомерным пространствам
https://habr.com/ru/company/otus/blog/488866/,Проверка образов с помощью Gitlab CI/CD
https://habr.com/ru/company/ruvds/blog/487878/,"5 вопросов по SQL, которые часто задают дата-сайентистам на собеседованиях"
https://habr.com/ru/post/488860/,Импортозамещение и судостроение
https://habr.com/ru/company/ods/blog/488852/,Настройка функции потерь для нейронной сети на данных сейсморазведки
https://habr.com/ru/post/488436/,Быстрое создание чиптюн-музыки на открытом ПО
https://habr.com/ru/post/488850/,Использование RabbitMQ вместе с MonsterMQ часть 1
https://habr.com/ru/company/redmadrobot/blog/488848/,CTO всея стартапа
https://habr.com/ru/company/1cloud/blog/488844/,Границы для пограничников: суд США установил правила для проверки устройств — обсуждаем ситуацию
https://habr.com/ru/company/ruvds/blog/488664/,Поиск идеального набора инструментов: анализ популярных шаблонов Python-проектов
https://habr.com/ru/company/alfa/blog/488840/,"4 марта, Екатеринбург — Java MeetUP"
https://habr.com/ru/company/oleg-bunin/blog/480628/,"Что мы узнали о SRE, когда обработали первые 150 тысяч продакшн-инцидентов"
https://habr.com/ru/post/488096/,400G. Вгляд со стороны Transmission. ZR/ZR+
https://habr.com/ru/company/zyxel/blog/488736/,Удалённая работа набирает обороты
https://habr.com/ru/company/yandex/blog/488682/,Как проверить навыки программирования на Python? Задачи от Яндекса
https://habr.com/ru/post/488830/,"Интернет в Туркменистане: цена, доступность и ограничения"
https://habr.com/ru/post/488836/,Некоторые аспекты работы с Dictionary при разработке нагруженных приложений
https://habr.com/ru/post/488834/,Как ошибка из 2009 вызывает конфликт Docker for Windows и Razer Synapse
https://habr.com/ru/company/dcmiran/blog/488832/,"Удивительно, но в прошлом году корпоративные HDD оказались популярнее SSD и их продажи растут"
https://habr.com/ru/company/rostelecom/blog/488696/,Возглавляя тренды
https://habr.com/ru/company/ascon/blog/488726/,"Интервью с инженером НИПТБ «Онега» — победителем WorldSkills Hi-Tech о работе, чемпионате и САПР"
https://habr.com/ru/company/lanit/blog/487944/,"Машинное обучение в энергетике, или не только лишь все могут смотреть в завтрашний день"
https://habr.com/ru/post/488610/,"История человека, чувствительного к электромагнитному излучению, или как мы щупаем край обрыва… UPD: +FAQ"
https://habr.com/ru/company/raiffeisenbank/blog/488824/,DGTL Design Community Meetup в Райффайзенбанке: трансляция
https://habr.com/ru/company/southbridge/blog/488800/,Agile: 9 вредных советов
https://habr.com/ru/company/cloud4y/blog/487360/,Обезличивание данных не гарантирует вашу полную анонимность
https://habr.com/ru/post/488594/,Пандас и другие для толстых данных
https://habr.com/ru/company/productsense/blog/488820/,"Как не выгореть на работе и что делать, если всё-таки выгорел"
https://habr.com/ru/company/mipt/blog/488818/,Прорывы #DeepPavlov в 2019 году: обзор и итоги года
https://habr.com/ru/company/microsoft/blog/487612/,"Легко добавляйте, удаляйте и переименовывайте файлы и цели в проектах CMake"
https://habr.com/ru/post/488780/,"Mozilla проиграла в войне браузеров, но всё ещё считает, что может спасти интернет"
https://habr.com/ru/post/488814/,Forge of Empires из AS3 в Haxe. Постмортем
https://habr.com/ru/company/pvs-studio/blog/488670/,О масочных регистрах
https://habr.com/ru/post/488030/,Как организовать скины в Symfony
https://habr.com/ru/company/leroy_merlin/blog/488648/,Опыт интеграции веб-компонентов на сайт Леруа Мерлен
https://habr.com/ru/company/tssolution/blog/488712/,Check Point WatchTower — управляем NGFW со смартфона
https://habr.com/ru/company/tssolution/blog/488686/,Применение Flowmon Networks для контроля производительности распределенных приложений и баз данных
https://habr.com/ru/post/488808/,"Программисты, давайте изучать исходники классических программ"
https://habr.com/ru/post/488570/,Как Секретная служба США перепутала киберпанк-RPG с учебником для хакеров
https://habr.com/ru/post/488806/,"Это не конструктивно, или Ты как челобитную царю подаешь?"
https://habr.com/ru/post/488796/,Учимся разворачивать микросервисы. Часть 2. Kubernetes
https://habr.com/ru/post/488792/,Мониторинг доступности сайта в России на коленке
https://habr.com/ru/post/488520/,Ляпы и загогулины. 2
https://habr.com/ru/post/488782/,А как вам такой вариант управления зависимостями в Python?
https://habr.com/ru/post/488626/,Как не пропустить невалидный код в репозиторий
https://habr.com/ru/post/488778/,"Структуры данных: список, который умеет всё*"
https://habr.com/ru/post/488144/,Руководство по версиям и возможностям Java
https://habr.com/ru/company/top3dshop/blog/488766/,Искусство и технология: Университет Массачусетса в Лоуэлле
https://habr.com/ru/company/top3dshop/blog/488732/,Талантливый мистер Саймон: как уникальные способности и 3D-печать могут изменить производственный процесс
https://habr.com/ru/post/488762/,Элегантное асинхронное программирование с помощью «обещаний»
https://habr.com/ru/company/ua-hosting/blog/488758/,Конференция DEFCON 27. Признание интернет-мошенницы
https://habr.com/ru/company/it-grad/blog/488750/,Прогулка с динозаврами: два больших компьютера XX века
https://habr.com/ru/post/488752/,Golang + Phaser3 = MMORPG — Делаем базу для бесконечной генерации мира
https://habr.com/ru/company/otus/blog/488748/,Создаем Todo приложение c помощью Django. Часть 1
https://habr.com/ru/post/488740/,Гайд по Custom HTML тегам для Google Tag Manager от Simo Ahava
https://habr.com/ru/company/ivideon/blog/488698/,Контроль доступа как услуга: облачное видеонаблюдение в СКУД
https://habr.com/ru/post/488478/,Перенос всех баз данных MS SQL Server на другую машину
https://habr.com/ru/post/488730/,"Новые российские стандарты интернета вещей, умного производства и умного города"
https://habr.com/ru/company/tinkoff/blog/488692/,Как мигрировать большой процесс с IBM BPM на Camunda и не останавливать разработку фич
https://habr.com/ru/company/trendmicro/blog/488728/,"Два способа взвинтить цену на нефть, или Атаки на нефтегаз как средство влияния на биржевые индексы"
https://habr.com/ru/company/otus/blog/488724/,6 лучших практик безопасности для Go
https://habr.com/ru/company/kaspersky/blog/488722/,Security Week 08: вирусы возвращаются
https://habr.com/ru/post/488720/,Web Scraping. Часть 1
https://habr.com/ru/company/otus/blog/488708/,Сохранение логики фильтрации в Swift Combine. Часть 2
https://habr.com/ru/post/488706/,2DOOM — браузерный 2D-трибьют легендарному шутеру
https://habr.com/ru/post/488690/,Распознавание символов методом наименьшего расстояния Левенштейна
https://habr.com/ru/company/postgrespro/blog/472082/,Postgresso 18
https://habr.com/ru/company/zimbra/blog/488680/,Защита списков рассылки от спама в Zimbra OSE
https://habr.com/ru/company/ruvds/blog/488668/,Создание CI/CD-цепочки и автоматизация работы с Docker
https://habr.com/ru/post/488672/,Отладка микроконтроллеров ARM Cortex-M по UART
https://habr.com/ru/company/sberbank/blog/488612/,Java-сериализация: максимум скорости без жёсткой структуры данных
https://habr.com/ru/post/488656/,Гонки космических шпионов
https://habr.com/ru/company/yamoney/blog/488376/,"Когда принцип «к чёрту всё, бери и делай!» не работает: заметки прокрастинатора"
https://habr.com/ru/post/488654/,"RabbitMQ. Часть 1. Introduction. Erlang, AMQP"
https://habr.com/ru/company/ds/blog/488356/,Обучение в Санкт-Петербургском Государственном Морском Техническом Университете продуктам Dassault Systèmes
https://habr.com/ru/post/488646/,«Красная» корпоративная культура — главная проблема российского бизнеса. (Часть 4)
https://habr.com/ru/post/488644/,Go vs Python. Виталий Левченко
https://habr.com/ru/post/488630/,Digital-мероприятия в Москве c 17 по 23 февраля
https://habr.com/ru/post/488632/,Digital-мероприятия в Санкт-Петербурге c 17 по 23 февраля
https://habr.com/ru/company/tuturu/blog/488584/,"Что вы захотите знать до того, как писать приложение под Apple Watch: наш опыт"
https://habr.com/ru/post/488638/,Безопасная загрузка в i.MX6
https://habr.com/ru/post/488280/,Как при помощи большого монитора и консольной утилиты WLSDM смотреть за Oracle WebLogic Server
https://habr.com/ru/company/epson/blog/488316/,"Epson EH-TW7100 – 4K HDR-проектор и размышления о том, что делает проектор «HDR-ready» и «4K-ready», в принципе"
https://habr.com/ru/post/488446/,Российское приборостроение: вертели мы ваш дизайн на пальцах
https://habr.com/ru/post/488636/,"Как немец-хохотун лук (тот, что со стрелами) прокачал"
https://habr.com/ru/company/funcorp/blog/488458/,FunCode Backend Java/Kotlin Challenge: объявляем имена победителей
https://habr.com/ru/post/488624/,Экономика взаимопомощи
https://habr.com/ru/post/488336/,Советы по использованию алгоритма коллапса волновой функции
https://habr.com/ru/post/488622/,Чеклисты заменяют регламенты?
https://habr.com/ru/company/digital-ecosystems/blog/488618/,Дайджест интересных материалов для мобильного разработчика #333 (10 — 16 февраля)
https://habr.com/ru/post/488616/,Null проблема в Data Science и Machine Learning
https://habr.com/ru/post/484714/,Современная сборка 2020 для frontend. Gulp4
https://habr.com/ru/post/488614/,Бобина 3.0.0 — обзор улучшений
https://habr.com/ru/post/488602/,iOS MEETUP #2 от FUNCORP и Как разработчику оставаться актуальным
https://habr.com/ru/post/488606/,Подлинная сущность ящеролюдей
https://habr.com/ru/post/488604/,Дайджест свежих материалов из мира фронтенда за последнюю неделю №402 (10 — 16 февраля 2020)
https://habr.com/ru/post/488600/,Как провайдеры заботятся о безопасности клиентов
https://habr.com/ru/company/clrium/blog/488260/,Планирование потоков в Windows. Часть 1 из 4
https://habr.com/ru/post/488590/,FOSS News №3 — обзор новостей свободного и открытого ПО за 10-16 февраля 2020 года
https://habr.com/ru/post/488598/,Готов ли мир к пандемии?
https://habr.com/ru/company/madrobots/blog/488596/,Google разработал алгоритм автоматического кадрирования видео по важным объектам в кадре
https://habr.com/ru/post/488592/,Открытое письмо компании Mail.ru об игре «Аллоды II: Повелитель душ»
https://habr.com/ru/post/488574/,Студенты пишут Uart драйвер для STM32F411
https://habr.com/ru/post/488586/,The Ember Times — Выпуск 135
https://habr.com/ru/post/488504/,Подключаем производственный календарь в Zabbix
https://habr.com/ru/company/intel/blog/488582/,Создание демо-приложения «Умная библиотека» с помощью Intel Distribution of the OpenVINO toolkit
https://habr.com/ru/post/465507/,Принцип единственной ответственности: глубокое погружение
https://habr.com/ru/post/487176/,Задержать COVID-19. Все про фильтрацию воздуха на случай пандемии
https://habr.com/ru/post/488576/,Эко-движ по-армянски: как простой настенный календарь перерос в большую антипластиковую кампанию
https://habr.com/ru/post/488568/,Мечтают ли нейросети об электроденьгах?
https://habr.com/ru/company/1cloud/blog/488550/,Кто хочет сделать из ИТ-гигантов кооперативы
