link,title
https://habr.com/ru/post/489622/,Сдруживаем Python и Bash: библиотеки smart-env и python-shell
https://habr.com/ru/post/489144/,Роботаракан Петя за десять баксов
https://habr.com/ru/post/489560/,Форма обратной связи в React Native при помощи AWS + Telegram
https://habr.com/ru/post/489576/,Нюансы современной медицины
https://habr.com/ru/post/489614/,Маркировка остатков обуви в 1С. Решение проблемы сканирования и выгрузки в «Честный знак»
https://habr.com/ru/post/482578/,Envoy. 1. Введение
https://habr.com/ru/post/489608/,Взаимодействие с NIDD через SCEF с использованием утилиты Postman. Краткий экскурс в SCEF и его возможности
https://habr.com/ru/company/maxilect/blog/489604/,"Как я, тимлид, оцениваю проекты"
https://habr.com/ru/post/489594/,Framework vs Platform: в чём разница?
https://habr.com/ru/company/digital-ecosystems/blog/489596/,Дайджест интересных материалов для мобильного разработчика #334 (17 — 23 февраля)
https://habr.com/ru/post/489590/,Что делать если программисту постоянно нечего делать?
https://habr.com/ru/post/488578/,Красно-чёрные деревья на javascript
https://habr.com/ru/post/489588/,"Hack The Box — прохождение Zetta. FXP, IPv6, rsync, Postgres и SQLi"
https://habr.com/ru/post/489586/,Визуализация звука на старинных лампах
https://habr.com/ru/post/489582/,В поисках «Годзиллы». Нейросети и прогнозирование котировок на основе биржевых и «внешних» данных
https://habr.com/ru/company/ua-hosting/blog/489568/,Конференция DEFCON 27. Изготовление дубликатов механических ключей с ограниченным доступом. Часть 1
https://habr.com/ru/post/489528/,Вы не смотрите рекламу во время разработки? Непорядок
https://habr.com/ru/company/pult/blog/489558/,"О Samsung обновившем TV-флагман: Q950 — изменения, косяки, а также прогнозы для нового устройства"
https://habr.com/ru/post/489552/,Диагностируем проблемы в микросервисной архитектуре на Node.js с помощью OpenTracing и Jaeger
https://habr.com/ru/post/489550/,7 трюков с Rest и Spread операторами при работе c JS объектами
https://habr.com/ru/post/489548/,"Примерно 20 строк, примерно такие же результаты: wc на Elixir"
https://habr.com/ru/post/489122/,Типизированные запросы OData в TypeScript
https://habr.com/ru/post/489166/,О работе ПК на примере Windows 10 и клавиатуры ч.2
https://habr.com/ru/post/489544/,Ресайз изображений на лету с помощью Nginx и LuaJIT (OpenResty)
https://habr.com/ru/post/489542/,Nano или минималистичный IDE
https://habr.com/ru/post/489540/,Отладка микроконтроллеров ARM Cortex-M по UART Часть 2
https://habr.com/ru/post/489538/,Почему разработчикам не нравится Agile?
https://habr.com/ru/post/489536/,Особенности систем электроснабжения с применением ДДИБП
https://habr.com/ru/company/jugru/blog/489532/,Что нового в Android 11 для пользователей и разработчиков
https://habr.com/ru/post/489530/,Что делает реактивную систему хорошей?
https://habr.com/ru/company/JetBrains-education/blog/489408/,Магистерская программа JetBrains на базе Университете ИТМО: интервью со студентами
https://habr.com/ru/company/iticapital/blog/489518/,В США появится лоукост-биржа Members Exchange
https://habr.com/ru/post/489516/,Дружим React Native и Fastlane
https://habr.com/ru/post/489504/,Как начать создавать карту в UE4
https://habr.com/ru/post/489490/,Крестики-нолики (PixiJS)
https://habr.com/ru/post/489482/,"Что нужно знать, если вы хотите вызывать Go функции из ассемблера"
https://habr.com/ru/post/489510/,Попытка решить проблему выбора авиабилетов перед отпуском #2
https://habr.com/ru/post/489512/,"Flutter. BlOC, Provider, async – архитектура «по полочкам»"
https://habr.com/ru/post/489492/,Яндекс.Диск запретил использование open source утилиты rclone
https://habr.com/ru/post/489500/,Оценка задач в Story Points
https://habr.com/ru/company/ua-hosting/blog/489332/,Неотъемлемые помощники в деле разведки наиболее эффективной в мире спецслужбы (часть 3)
https://habr.com/ru/company/englishdom/blog/489464/,«I’ll be back!»: как изменился английский Арнольда Шварценеггера за 50 лет в США
https://habr.com/ru/post/489486/,Применяем Data Science в мирных целях покупки дома
https://habr.com/ru/post/489340/,Как максимальной единицей передачи информации в интернете стали 1500 байт
https://habr.com/ru/post/489476/,Стилизация флажков и переключателей с использованием CSS3
https://habr.com/ru/company/habr/blog/489418/,"Хабр Викли #40 / Мозилла спасает интернет, в геймдеве кончились идеи, и зачем изучать исходники классических программ"
https://habr.com/ru/post/489354/,"IdentityServer4. Основные понятия. OpenID Connect, OAuth 2.0 и JWT"
https://habr.com/ru/post/489472/,Веб-архив: импортозамещение
https://habr.com/ru/post/489470/,Соревновательный потенциал Besiege-подобных симуляторов
https://habr.com/ru/post/489468/,Простое Slack приложение для публикации контента из Google Sheets
https://habr.com/ru/post/489460/,Ультрафиолет на двух пальцах
https://habr.com/ru/post/489328/,Null подкрался незаметно: ломаем Scala Option с помощью Java
https://habr.com/ru/post/489436/,"Очистка данных, как игра «Камень, Ножницы, Бумага». Это игра с финишем или без? Часть 2. Практическая"
https://habr.com/ru/company/madrobots/blog/489414/,Безумные роботы в Вегасе. Поездка на CES 2020
https://habr.com/ru/post/489440/,Преимущества переезда на ПМЖ в Берлин для ИТ-специалистов
https://habr.com/ru/post/489426/,"Представляем PHP 7.4: Производительность, Возможности, Устаревший Функционал"
https://habr.com/ru/post/489424/,Методы автоматизированного тестирования
https://habr.com/ru/company/it-grad/blog/489404/,Детство компьютерных вирусов
https://habr.com/ru/post/489412/,Превратит ли медицина 2030 года Homo sapiens в Homo longevus – сверхдолгожителей
https://habr.com/ru/company/itelma/blog/483960/,Брэд Тэмплтон: Итоги 2019 года для индустрии автономных автомобилей
https://habr.com/ru/company/otus/blog/489366/,Почему для SQL Server важна статистика
https://habr.com/ru/company/wrike/blog/489400/,Звездолеты на ДВС. Выжить в схватке с техническим долгом
https://habr.com/ru/company/qiwi/blog/489390/,"Новая QIWI Кухня — уже 5 марта. Москва, AGLOFT"
https://habr.com/ru/company/badoo/blog/489362/,Что делать с легаси. Материалы с Badoo PHP Meetup #4
https://habr.com/ru/company/dodopizzadev/blog/489352/,Что можно узнать о Domain Driven Design за 10 минут?
https://habr.com/ru/post/489368/,"Очистка данных, как игра «Камень, Ножницы, Бумага». Это игра с финишем или без? Часть 1. Теоретическая"
https://habr.com/ru/company/plarium/blog/489394/,"Как питомцы могут сделать из вас хорошего программиста (да, они действительно это могут!)"
https://habr.com/ru/post/489386/,Так вы хотите стать Ruby разработчиком?
https://habr.com/ru/company/otus/blog/489384/,Создать мощный курс Machine Learning: миссия выполнена
https://habr.com/ru/company/JetBrains/blog/489382/,"Первый воркшоп Corporate Rebels в России, 8 апреля"
https://habr.com/ru/company/parallels/blog/489376/,Управление Mac в мире Windows
https://habr.com/ru/company/vdsina/blog/489380/,Как запустить стартап с минимальными потерями: 23 правила
https://habr.com/ru/post/489364/,Шпаргалка аналитику: как «раскопать» систему
https://habr.com/ru/post/489360/,Разбираемся с управлением памятью в современных языках программирования
https://habr.com/ru/company/otus/blog/489356/,"CI/CD на AWS, Azure и Gitlab. Новый курс от OTUS"
https://habr.com/ru/company/exness/blog/489214/,Современный подход к тестированию локализации на iOS
https://habr.com/ru/company/jugru/blog/489310/,Tоп-10: лучшие доклады Heisenbug 2019 Moscow
https://habr.com/ru/post/488874/,Моя попытка номер 5
https://habr.com/ru/company/ruvds/blog/488666/,10 React-компонентов на все случаи жизни
https://habr.com/ru/company/jugru/blog/489290/,"«Работа в ИТ — 2020», или Кого и за что мы любим"
https://habr.com/ru/post/489348/,Настройка VPS на максимальную производительность
https://habr.com/ru/company/vivaldi/blog/489344/,Не оставляя следов
https://habr.com/ru/post/488702/,Модель натурального ряда чисел и его элементов. Кратные клетки строк
https://habr.com/ru/post/489336/,"Интерфейсные байки Токсичного Деда. “Учиться, учиться и еще раз учиться” (s1 e3)"
https://habr.com/ru/company/jetinfosystems/blog/489234/,Как успешно пройти любой пентест (вредные советы)
https://habr.com/ru/company/ua-hosting/blog/489242/,"«Загляните, это нечто»: саморепликация искусственной ДНК"
https://habr.com/ru/company/piter/blog/489326/,Размышления об эффективном enterprise-тестировании
https://habr.com/ru/company/microsoft/blog/488572/,Unity Analyzers теперь Open-Source
https://habr.com/ru/post/488998/,Почему требования к ИИ объясниться могут только ухудшить ситуацию
https://habr.com/ru/company/playme/blog/489286/,"Трусы, носки и помазок: антирейтинг подарков на 23 Февраля"
https://habr.com/ru/post/489232/,Назад в будущее мобильных телефонов II
https://habr.com/ru/company/flant/blog/488920/,Определяем подходящий размер для кластера Kafka в Kubernetes
https://habr.com/ru/company/ibm/blog/489320/,Практика использования AI. Воркшоп «Анализ изображений дронов для выявления поврежденных домов»
https://habr.com/ru/post/489118/,Реверс-инжиниринг рендеринга «Ведьмака 3»: различные эффекты неба
https://habr.com/ru/post/489294/,Разбираемся с переменными в CSS на реальном примере
https://habr.com/ru/company/ibm/blog/489318/,Митап «DevOps масштабируемых систем»
https://habr.com/ru/post/489044/,Физика текста. Часть 1. Символы
https://habr.com/ru/post/489314/,"Четвертушка Ethernet-а: старая скорость, новые возможности"
https://habr.com/ru/post/489020/,Исследование одного вредоноса
https://habr.com/ru/company/JetBrains-education/blog/489304/,Анализ данных ChIP-seq: от гистонов к информатическим задачам
https://habr.com/ru/post/489306/,[Habr]: Донаты
https://habr.com/ru/post/489298/,Неформальное интервью с Марией Долгушевой (HR из Кремниевой Долины)
https://habr.com/ru/post/489296/,Функциональные опции на стероидах
https://habr.com/ru/company/ua-hosting/blog/488816/,"Как мы потеряли «Мир»: пожар на космической станции, столкновение с грузовиком «Прогресс», разгерметизация"
https://habr.com/ru/company/mailru/blog/489270/,WebAuthn в реальной жизни
https://habr.com/ru/post/489136/,Побеждая C двадцатью строками Haskell: пишем свой wc
https://habr.com/ru/company/actualizebot/blog/489008/,Роутинг в комплексных чат-ботах с Hobot framework
https://habr.com/ru/post/489284/,Мои любимые инструменты разработчика Chrome
https://habr.com/ru/post/489132/,Самое интересное с Integrated Systems Europe 2020
https://habr.com/ru/post/489282/,DirectX 12 — от Леонардо да Винчи к современному искусству
https://habr.com/ru/company/otus/blog/489280/,Пинг всех узлов IPv6 на канале
https://habr.com/ru/company/lifext/blog/489276/,"Анализ крови на железо — как контролировать уровень, диагностирование причин, почему это важно"
https://habr.com/ru/company/otus/blog/489274/,Assert-сообщения в тестах
https://habr.com/ru/company/pult/blog/489272/,"Глаза, мозг, качество видео: размышления о 120fps, 8K, HDR, палочках, колбочках и «эффекте мыльной оперы»"
https://habr.com/ru/company/dodopizzadev/blog/489218/,Наивно. Супер: код и архитектура простой игры
https://habr.com/ru/post/489268/,Реализация процесса выгрузки файла из контейнера с браузером в тестовый фреймворк
https://habr.com/ru/post/489226/,Методы оптимизации LINQ-запросов в C#.NET
https://habr.com/ru/company/otus/blog/489262/,Почему непросто давать разработчикам свободу выбора
https://habr.com/ru/post/489260/,Как за семь шагов спроектировать масштабную автоматизированную систему для крупного предприятия
https://habr.com/ru/company/otus/blog/489258/,Как в Python реализованы очень длинные числа типа integer?
https://habr.com/ru/company/phoenix_contact/blog/489256/,Системы автоматизации на основе Foundation Fieldbus
https://habr.com/ru/post/489252/,История Telegram: от идеи до собственной криптовалюты
https://habr.com/ru/post/489254/,Яндекс помогает распространять вредоносное ПО?
https://habr.com/ru/company/zabbix/blog/489244/,Разработка плагинов для Zabbix Agent 2
https://habr.com/ru/company/avito/blog/488716/,"Материалы с казанского митапа по фронтенду: Phoenix LiveView, фронтопс, JSON:API"
https://habr.com/ru/post/489246/,Мне 14 и я решил разработать игру
https://habr.com/ru/company/JetBrains/blog/489156/,Кто умнее чем IDEA?
https://habr.com/ru/post/489236/,Spring: в поисках контекста
https://habr.com/ru/company/it_people/blog/489240/,Особенности региональных конференций. Зачем спикеру выезжать за МКАД?
https://habr.com/ru/company/epam_systems/blog/489198/,"Как не выстрелить себе в ногу, используя Liquibase"
https://habr.com/ru/company/hflabs/blog/489074/,Как определить оператора и регион по номеру телефона
https://habr.com/ru/company/tinkoff/blog/489230/,Что такое производительность веб-приложений?
https://habr.com/ru/post/489228/,Речевой бот в банке — худший UX ever
https://habr.com/ru/company/ruvds/blog/489208/,Виртуальный сервер для онлайн-трейдинга
https://habr.com/ru/post/489212/,1С-Битрикс препятствует отписке от рассылки требованием сдать свои персональные данные
https://habr.com/ru/post/489182/,varchar(max)-varchar(max) и в продакшн
https://habr.com/ru/post/489200/,Какие стартапы ищет Y Combinator в 2020 году
https://habr.com/ru/company/ruvds/blog/488660/,Пришло ли время забыть о React и перейти на Svelte?
https://habr.com/ru/company/mailru/blog/488192/,Устройство Helm и его подводные камни
https://habr.com/ru/post/489196/,Волшебный дым: микроконтроллеры против линейных регуляторов
https://habr.com/ru/company/redhatrussia/blog/489194/,Как OpenShift меняет организационную структуру ИТ-организации. Эволюция организационных моделей при переходе на PaaS
https://habr.com/ru/company/mkb/blog/488904/,Применение статического анализатора кода SwiftLint в iOS мобильных приложениях банка
https://habr.com/ru/company/smartengines/blog/489192/,Smart Engines вошёл в тройку лидеров в рейтинге FWCI среди базовых организаций Физтеха
https://habr.com/ru/company/top3dshop/blog/489184/,Fast Forward: 3D-технологии в дизайне и производстве
https://habr.com/ru/company/cloud4y/blog/488642/,"Паутина на дне стакана, или что объединяет американский виски и науку"
https://habr.com/ru/company/dcmiran/blog/489190/,Исследование RedHat: open source вытесняет проприетарное ПО из корпоративного сегмента
https://habr.com/ru/post/489188/,Логирование в микросервисной среде .Net на практике
https://habr.com/ru/post/489108/,Добавление своих полей в отчет Pytest
https://habr.com/ru/company/yandex/blog/488428/,Как мы предсказываем будущее в поиске Яндекса: от исправления ошибок до discovery-запросов
https://habr.com/ru/company/ntc-vulkan/blog/489186/,TDD для микроконтроллеров. Часть 3: Запуск на железе
https://habr.com/ru/post/489160/,Результаты исследования откликов на вакансию дизайнера цифрового продукта. Часть первая — результаты и статистика
https://habr.com/ru/company/dodopizzadev/blog/488246/,VoiceOver на iOS: каждый контрол ведёт себя по-разному
https://habr.com/ru/post/489178/,GSMout – приём SMS и звонков «как дома»
https://habr.com/ru/post/483738/,Микропост: режем UNICODE-строки для PostgreSQL
https://habr.com/ru/post/489172/,Прикручиваем ActiveDirectory авторизацию к Kubernetes c помощью Keycloak
https://habr.com/ru/company/sberbank/blog/489158/,"Sber.DS — платформа, которая позволяет создавать и внедрять модели даже без кода"
https://habr.com/ru/company/microsoft/blog/488566/,"Как QA-инженер сэкономил целый день работы, связав автотесты в Visual Studio и Test IT"
https://habr.com/ru/post/489004/,Сотовый телефон с дисковым номеронабирателем
https://habr.com/ru/post/489134/,Исследование дизайн-команд в российских продуктовых компаниях
https://habr.com/ru/post/488608/,«СЛАВА ЖПСС!» или вспоминаем про GPSS World
https://habr.com/ru/company/alconost/blog/489128/,Интернационализация: как вывести продукт на международный рынок (и не сойти с ума)
https://habr.com/ru/company/intel/blog/488812/,"Больше SoC, хороших и разных. Intel открывает AIB для разработчиков и производителей"
https://habr.com/ru/company/tssolution/blog/488854/,10. Fortinet Getting Started v6.0. Сопровождение
https://habr.com/ru/company/nixys/blog/489164/,Обновление Kubernetes-кластера без простоя
https://habr.com/ru/post/489162/,Менеджер-передаст
https://habr.com/ru/post/489142/,Лекции со школы по биоинформатике от А до Я
https://habr.com/ru/post/489152/,Петербург против Парижа: как музеи пополняют и как уменьшают общественное достояние
https://habr.com/ru/post/489146/,802.11ba (WUR) или как скрестить ужа с ежом
https://habr.com/ru/post/488810/,Оживляем гексапода. Часть первая
https://habr.com/ru/post/489126/,История одного программиста с биполярным расстройством
https://habr.com/ru/post/489086/,RabbitMQ. Часть 2. Разбираемся с Exchanges
https://habr.com/ru/post/489120/,Роботы и люди. Что говорит наука о готовности людей получать услуги у роботов
https://habr.com/ru/post/489106/,Как я бросил журналистику и стал программистом
https://habr.com/ru/post/489100/,Анализ данных по коронавирусу SARS-CoV-2 (2019-nCov)
https://habr.com/ru/company/madrobots/blog/489070/,Это будет стоить 354 пары носков. Подборка подарков на 23 февраля
https://habr.com/ru/company/vdsina/blog/489092/,Как я самостоятельно выучил новый язык за 12 месяцев: тотальный гайд
https://habr.com/ru/post/485616/,Добавляем статические файлы вне проекта ангуляр
https://habr.com/ru/post/489082/,Нейросети в трейдинге. Рано хоронить
https://habr.com/ru/company/otus/blog/489080/,"Укрепите свои agile-команды, используя стадии развития Такмена"
https://habr.com/ru/company/leader-id/blog/489000/,Как собрать крутой митап: 16 советов от трех «серийных митаперов». Leader-IT events #1
https://habr.com/ru/post/489076/,Имитационная модель процесса обработки материала резанием на токарном станке с ЧПУ
https://habr.com/ru/post/489072/,Преимущества 3СХ при построении распределенной сети
https://habr.com/ru/post/489068/,Цифровое бессмертие — инженерный подход
https://habr.com/ru/company/otus/blog/489062/,Невероятная производительность ввода-вывода с параллельным Apache Parquet на Python
https://habr.com/ru/post/489042/,Торжественное переоткрытие Store: загрузка данных в Android с помощью корутин
https://habr.com/ru/company/ru_mts/blog/488828/,"Спам, спам, спам…"
https://habr.com/ru/company/iticapital/blog/489060/,Разбор: чем отличаются высокорисковые и низкорисковые инвестиции
https://habr.com/ru/post/489058/,Ансамбли нейронных сетей с PyTorch и Sklearn
